{"schema": "merlin.lean.ir.v1", "source": {"sha256": "7bf69efe428c80c2fe0ae3deb83e729cd0d9ca9a5863ea6729387afee3bda315", "bytes": 340}, "producer": {"tool": "merlin.verify.lean.mlir_export(torch_mlir)", "version": "1"}, "module": {"ops": [{"name": "func.func", "results": [], "operands": [], "attrs": {"function_type": {"kind": "type", "value": {"kind": "function", "inputs": [{"kind": "int", "width": 1}, {"kind": "int", "width": 1}], "results": [{"kind": "float", "format": "f32"}]}}, "sym_name": {"kind": "string", "value": "subject"}}, "props": {}, "regions": [{"blocks": [{"args": [{"id": 0, "type": {"kind": "int", "width": 1}}, {"id": 1, "type": {"kind": "int", "width": 1}}], "ops": [{"name": "arith.uitofp", "results": [{"id": 2, "type": {"kind": "float", "format": "f32"}}], "operands": [0], "attrs": {"prov.transforms": {"kind": "string", "value": "bool_sitofp_uitofp"}}, "props": {}, "regions": [], "successors": []}, {"name": "arith.constant", "results": [{"id": 3, "type": {"kind": "float", "format": "f32"}}], "operands": [], "attrs": {"value": {"kind": "float", "bits": "3f800000", "type": {"kind": "float", "format": "f32"}}}, "props": {}, "regions": [], "successors": []}, {"name": "func.return", "results": [], "operands": [2], "attrs": {}, "props": {}, "regions": [], "successors": []}]}]}], "successors": []}], "attrs": {}, "props": {}}}