{"module": {"attrs": {}, "ops": [{"attrs": {"function_type": {"kind": "type", "value": {"inputs": [{"kind": "int", "width": 16}, {"kind": "int", "width": 16}, {"kind": "int", "width": 16}], "kind": "function", "results": [{"kind": "int", "width": 16}]}}, "sym_name": {"kind": "string", "value": "source"}}, "name": "func.func", "operands": [], "props": {}, "regions": [{"blocks": [{"args": [{"id": 0, "type": {"kind": "int", "width": 16}}, {"id": 1, "type": {"kind": "int", "width": 16}}, {"id": 2, "type": {"kind": "int", "width": 16}}], "ops": [{"attrs": {"overflowFlags": {"dialect": "arith", "kind": "enum", "name": "overflow", "value": "none"}}, "name": "arith.muli", "operands": [0, 1], "props": {}, "regions": [], "results": [{"id": 3, "type": {"kind": "int", "width": 16}}], "successors": []}, {"attrs": {"overflowFlags": {"dialect": "arith", "kind": "enum", "name": "overflow", "value": "none"}}, "name": "arith.addi", "operands": [3, 2], "props": {}, "regions": [], "results": [{"id": 4, "type": {"kind": "int", "width": 16}}], "successors": []}, {"attrs": {}, "name": "func.return", "operands": [4], "props": {}, "regions": [], "results": [], "successors": []}]}]}], "results": [], "successors": []}], "props": {}}, "producer": {"tool": "merlin.verify.lean.mlir_export(torch_mlir)", "version": "1"}, "schema": "merlin.lean.ir.v1", "source": {"bytes": 401, "sha256": "9a1e394c6cb26b0c5a4a72ea6bcd019779af288ee6a64dba5a7de9fa09f71f44"}}
