{"schema": "merlin.lean.ir.v1", "source": {"sha256": "cb480694b4e6e6d5b062bf0d64495224b36db8beb355172183812b7f3f6418de", "bytes": 234}, "producer": {"tool": "merlin.verify.lean.mlir_export(torch_mlir)", "version": "1"}, "module": {"ops": [{"name": "func.func", "results": [], "operands": [], "attrs": {"function_type": {"kind": "type", "value": {"kind": "function", "inputs": [{"kind": "int", "width": 1}, {"kind": "int", "width": 1}], "results": [{"kind": "float", "format": "f64"}]}}, "sym_name": {"kind": "string", "value": "subject"}}, "props": {}, "regions": [{"blocks": [{"args": [{"id": 0, "type": {"kind": "int", "width": 1}}, {"id": 1, "type": {"kind": "int", "width": 1}}], "ops": [{"name": "arith.sitofp", "results": [{"id": 2, "type": {"kind": "float", "format": "f64"}}], "operands": [0], "attrs": {}, "props": {}, "regions": [], "successors": []}, {"name": "func.return", "results": [], "operands": [2], "attrs": {}, "props": {}, "regions": [], "successors": []}]}]}], "successors": []}], "attrs": {}, "props": {}}}